{
  "event": "session_end",
  "session_id": "sess-scrub-label",
  "project_id": "proj-abc",
  "captured_at": "2025-06-30T10:00:00.000Z",
  "kind": "transcript",
  "turns": [
    { "role": "user", "text": "here is my aws key AKIAEXAMPLE and a jwt" },
    { "role": "assistant", "text": "redacted." }
  ],
  "client_scrub_applied": true,
  "client_scrub_hits": 3,
  "client_scrub_hits_by_label": { "aws_key": 2, "jwt": 1 },
  "client_version": "0.6.0",
  "client_scrub_version": "1.2.0",
  "wire_version": "v1.0"
}
